ID,Joke
788,"What is the greatest intermolecular force of all time? Dipole, dipole, dipole, dipole, and dipole!"
789,Why does an elephant have 4 Feet? Because it would look ridiculous with 8 inches.
790,What's the difference between a midget and a venereal disease? One's a cunning runt and the other's a running cunt.
791,[dinner table] gfs dad: so what do you do for a living me: human trafficking *he chokes* gf: he's a crossing guard dad
792,What do you call a dog with short legs and steel balls? Sparky
793,What is nine inches long and keeps a woman up screaming all night? Sudden Infant Death Syndrome
794,My new bowflex comes tomorrow...so if anyone wants to buy a slightly used bowflex in a couple months let me know.
795,What's the best reason to date a pornstar? You never have to meet her father.
796,Judge: I sentence you to life in prison Defendant: NOOOO MY ONLINE PRESENCE
797,"What does James Bond say after a heavy workout? I would like to have Whey. Shaken, not stirred."
798,Don't look out of the window Betty people will think it's Halloween.
799,I'm trying to explain Twitter to this cop. He still wants to know why I'm driving naked.
800,"Why shouldn't you sleep with a weatherman? They'll promise 12 to 14 inches, but you'll only get 3 to 5."
801,Why did the feminist refuse to work at the post office? Because it was a mail dominated industry
802,"Damn girl, are you a jar of pickles? Because I think I NEED to bang you on my kitchen counter."
803,Why did the Gorilla visit Italy? An advertisement's headline enticed him - See Ape-les and die!
804,"What do you do with an elephant with three balls? Walk him and pitch to the rhino. For non-Americans, this is a baseball joke"
805,"One hair in my soup Waiter, I am outraged. There is one hair in my soup. - And what do you expect for this price? A whole wig?!"
806,"Your baby might be adorable, but so is my cat and she cleans her own butt."
807,What do elephants do in the evenings ? Watch elevision !
808,"""Man, what's eating you today? *looks down* I Don't know.... GET IT OFF OF ME!!!"
809,"Student: Teacher, can I ask you a question? Teacher: You just did."
810,"When Noah was loading the Ark, where did he put the bees? In the Ark-hives."
811,"Star Wars (1977, PG) a group of terrorists enlist the aid of a drug smuggler and a religious fanatic to bomb the seat of governmental power."
812,H: You look nice. Me: I'm meeting one of my Twitter friends today. H: So you want your picture on the evening news to be a nice one? Me: Yep
813,What do you call an inspiring jerk session? A stroke of genius!
814,Did you hear about the man who choked on an issue of The Guardian after learning about his brothers passing? He found the news hard to swallow.
815,"Sometimes I'll start talking to someone on the train, then go ""Oh, this is where I get off"" then close my eyes & stick my hand in my pants."
816,Could you kill a monster just by throwing eggs at him? Of course - he'd be eggs-terminated.
817,"TIFU when I deleted my gym membership, hit my lawyer, &amp; posted it to Facebook."
818,What job do rabbits at hotels have?  Bellhop.
819,Person who fought in WWII hit with pepper spray... Now he is a seasoned veteran.
820,"what is the best way to smuggle drugs? In your dogs asshole. Should there be border control frisking, it will be perceived as two dogs plain wolfing"
821,"Browsing this sub is like mining in a cave Full of bat shit and I mostly get the same things over again, but it's worth the occasional gold I find."
822,Velcro. What a rip off!
823,What did the snail say when he was riding on the back of the turtle? Weeeeeeeeee
824,What bees makes the best milk ? Boob-bees And also this is my first time using Reddit and my account is only 30 minutes old by the time of this post so I have no idea what I am doing
825,My son got me some very expensive cologne for Father's Day. I know it was very expensive because he used my credit card.
826,I work hard so my dog can have a better life.
827,My inspiration for jokes is like a guy at a brothel... It comes and goes... It also occasionally sucks ;)
828,What's a minister's favorite food? Tacos al pastor
829,"How does a nihilist propose to his fiancee? ""Even though my existence is meaningless I want to spend the rest of it with you."""
830,What is the worse thing for a guy to say after sex? My name is Barry Allen
831,What's the difference between Jews and Santa? Santa goes down the chimney.
832,"The other day, I was looking through my socks, when I found one had a hole in it... ""darn it..."" I muttered."
833,"The pub manager is showing the new busboy around the kitchen, when they come to two doors. The busboy asks, ""Which one is the 'in' door?"" ""Let me show you"", says the manager, and 'e walks in."
834,"Me: When I was lying in bed, I found this huge lump. I need it removed. Doctor: Ma'am, that's your husband. Me: And your point is...?"
835,How can you tell Russians are bad at driving stick? cause their cars are always Stalin
836,I did a terrible job preparing for my Blue Man Group audition and boy is my face red
837,Why don't I take my guinea pigs on walksies It's hard on my cavies
838,Why can't you tell secrets in a corn field? ...because there are too many ears.
839,"I lost my job at the hospital today for sexual assault.... It's not my fault that they put up a sign that said, 'stroke patients downstairs'."
840,"CW: The boss said she wanted to see you. Me: That's flattering, but I don't date people from work."
841,I thought The Walking Dead was having a special tonight.... Turns out it was just The Rolling Stones performing at the 12/12/12 concert.
842,Fruit and urinal give a bad name to cakes everywhere.
843,"A priest, a rabbi and a leprechaun walk into a bar. The leprechaun says, ""Bejesus, I'm in the wrong joke!"""
844,"How many Jews does it take to change Hitler's mind? None, there has to be no Jews."
845,"Come on, there has got to be at least one business like show business."
846,"That Hamburger Helper hand guy. There's a twin out there, right? Didn't go into showbiz. Maybe an accountant or something."
847,Two guys walk into a bar.. The third guy ducked.
848,"""Your mission... Should you chose to accept it..."" *Go to a bar you Hate *Put $50 in the Jukebox *Play nothing but Nickelback *Leave"
849,Q) How do you spot a happy motorcyclist in  fair weather? A) He's got bugs on his teeth.
850,"According to my google history, I spent most of last night trying to buy a llama."
851,Pupil: My teacher was mad with me because I didn't know where the Rockies were. Mother: Well next time remember where you put things!
852,What do you call a hot day in Canada? A Nova Scorcha!
853,"How many Freudians does it take to change a lightbulb. Two. One to hold the light bulb and the other to hold the penis. I mean mother. Shit, I mean ladder."
854,What did the old maid get the vasaline for? 84 cents. Joke by my grandfather
855,Teacher: How much is half of 8 Pupil: Up and down or across ? Teacher: What do you mean ? Pupil: Wellup and down makes a 3 or across the middle leaves a 0
856,I got asked how I view lesbian relationships.. Apparently HD wasn't the correct answer.
857,Why did Adele cross the road? She wanted to say hello from the other side. ^^^^^^hilarious ^^^^^^and ^^^^^^original ^^^^^^hahahahahahahahahelpme
858,What do you call a dead blonde in a closet? The winner of last year's hide &amp; go seek contest.
859,What do you call children born of ginger people? Ginger-bred
860,"If you crossed a cow with Michael Jackson what song would you get? ""Beeflt!"""
861,How many McDonald's counter girls does it take to change a light bulb? Two. One to change it and one to put some chips with it.
862,Imagine me naked. Wrong. Fatter.
863,ADHD is ADD in high definition.
864,"The director of ""A Girl in the River"" went to high school with me in Karachi! She won an Oscar! This is not gonna help w my parents. #Oscars"
865,What is a name for a female lawyer? Sue
866,"I heard a guy at the beach screaming, ""HELP! SHARK! HELP!"" I just laughed. I knew that Shark wasn't going to help him."
867,What Is Bluetooth ? When your toothbrush stops working mid brushing
868,Why don't you see hippos hiding in trees? Because they're really good at it.
869,I bet a lot more people would read the Bible if it was called The Adventures of Jesus and Friends.
870,I have a split personality No he doesn't
871,"Duck Dynasty guy is right-- if we baptize all those ISIS guys, Iraq will be safe because Christians never start wars for bullshit reasons."
872,What do people call their grandmother in India? Naana
873,I don't trust stairs They're always up to something...
874,"The pope walks into a Mosque A Muslim looks up and asks ""Why the wrong faith?"""
875,Twitter is working worse than a dollar store pregnancy test.
876,Why were they called the dark ages? Because there were so many knights! Credit: watching Mr. D on Netflix
877,"Who is this ""one""? And why is he always arguing with people?"
878,I had this problem where the cap wouldn't stay on my whiskey bottle. So I fixed it with scotch tape.
879,What's Miley Cyrus eating for Thanksgiving.. Twerky!
880,"Prison counts as a gated community, right?"
881,What Do you get when you cross a kangaroo and a Sheep? A WOOLY JUMPER :)
882,"On your first day in jail, when they ask you what you're in there for, say ""the food"" so all the other prisoners know you're a loose cannon."
883,Farting is your ass referring to itself in the turd person.
884,What do you call a dinosaur that raps about life? A philosorapper
885,A blind dude walks into a bar. Ouch.
886,[breakfast table] Me: Who killed the entire box of Lucky Charms? 8: Not me 9: Not me CEREAL KILLER: Not me either
887,Remember when teachers asked to lie quietly with your head on your desk? My boss has yet to be impressed with this skill.
888,"Normally I can't dance to save my life, but as soon as I step in dog shit, I can moonwalk better than Michael Jackson"
889,Just Friends is my favorite movie that shows fat guys how to get out of the friendzone through perseverance and becoming Ryan Reynolds.
890,[school teacher job interview] Can I ask you some questions? I don't know CAN you? haha impressive [stands] welcome aboard!
891,The Philippines is the only country in the world who turns its flag upside down during times of war while French people remove the red and blue colour
892,I like cheese more than I like most people.
893,"How many cats does it take for a woman to qualify as a ""crazy cat lady?"" None. Just a couple of youtube cat videos."
894,It's funny how liberals think Donald Trump oppresses women and hates gays Like he's a Muslim or something.
895,"My wife is so moody at Christmas, I blame the festive period."
896,Knock Knock Who's there ! Alistair ! Alistair who ? Alistairs in this house are broken !
897,Interviewer: Where were you born? Me: Missouri. I: What state are you in now? M: Apathy. I: That's not what I meant. M: I don't care.
898,"A pharmacy was just robbed. A pharmacy was just robbed $500,000. Security camera footage recorded the criminal taking 2 bottles of aspirin and a Zoloft."
899,Why do elephants have big flat feet? To stamp out flaming ducks.
900,What kind of cheese is made backwards? Edam.
901,What's the difference between Iceland and Ireland? A consonant.
902,What do toads drink ? Croaka-cola !
903,"When I was younger, I was given a choice: a good memory or a long dong. I can't remember which I chose."
904,"Arnold Schwarzenegger glancing up excitedly and then looking away disappointedly multiple times while watching the intro to ""Hey Arnold"""
905,Ironically its exactly 12 steps from my car to the liquor store
906,This mallard waddled into a bar... Should've ducked.
907,Chicks with big tits always seem to say the right things.
908,[Touring Italy] Guide: Bathroom anyone? Me: I peed at the Tower of Pizza Guide: That's Pisa Me: Sorry. I took a pisa at the Tower of Pizza
909,Bough some shoes from my drug dealer. They were pretty nice
910,"A pirate's walking down the beach.... ...when he comes across a little girl. The litter girl says, ""Hey Pirate! Where's your buccaneers??"" The pirate responds, ""tucked inside my buck'n hat!!"""
911,What is the Pope's favorite type of woman? Nun
912,I used to think people who looked for sex on craigslist were rock bottom... Then I discovered twitter.
913,The Walking Dead Season Finale Check back in six months for the punchline.
914,"Proper punctuation... Proper punctuation is the difference between ""helping your Uncle, Jack, off a horse"" and ""helping your uncle jack off a horse"" It's a classic, but a good one"
915,can't now.. having an heated argument with my toaster.
916,"""Why do white people like cheese so much?"" Because they're made from cultures! Edit: Five BLM members disliked this post."
917,"Listen, I hate you... I'm just not... IN hate with you."
918,My grandfather's holocaust stories aren't half as depressing as the contestant interview segment on Jeopardy.
919,"""That'll be $15.99 please"" ""Do you take giant revolving badgers?"" *cashier grabs me by the throat* ""We ONLY take giant revolving badgers"""
920,"Why does Mexico never get gold medals in olympics? Because all their swimmers, runners, and high jumpers are in USA."
921,What kind of headphones are sold in 50 shades of grey? Beats
922,Why did everyone bring a quiche to Sean Connery's party? It was leave your keys at the door.
923,How do you know when a mongol is level? He's drooling from both corners of his mouth.
924,Nothing is more frightening than accidentally making eye contact with a guy who runs a mall kiosk.
925,Wanna heare a joke about potassium? K
926,I showed up later to dinner yesterday because I was baking a turkey. I'm the turkey.     Il see myself to the kitchen table.
927,What do you get when you combine Avogadro's number of avocados? GuacaMole!
928,What do you call a computer that only plays sad songs? Adele
929,"Why do scuba divers roll backwards out of the boat? Cause if they rolled forwards, they would still be in the boat."
930,"Can I get a pina colada please. 'This is Starbucks' Sorry, can I have venti pina colada."
931,"[Enter restaurant] WIFE: See if you can get us a table ME: Ok [1 minute later] ME: [sprinting towards wife, carrying table] START THE CAR"
932,They're remaking Ocean's 11 with an all-female cast and it's gonna be called Ocean's 8 It's that damn wage gap I tell ya!
933,why did hitler commit suicide? Because he saw the gas bill (Thanks nofx)
934,"A man caught me applying chap stick, so I just started eating it so it wouldn't be weird."
935,"A job interview.  What's your worst quality?  Honesty.  Well, i don't think that honesty is a bad quality..  I don't give a fuck what you think."
936,"Girlfriend: ""babe it's hot I need a fan"" [Boyfriend starts taking pictures with her and BEGGING for autographs]"
937,"H: Well, the remote was definitely broken, so I went and bought a new one. Me: H: Oh, and it came with this 75"" television."
938,The economy is so bad I went to buy a toaster and they gave me a bank.
939,"I'll never forget the words of my late Grandfather... ""Sorry I'm late."""
940,I want to die in my sleep like my grandfather... Not screaming and yelling like the passengers in his car.
941,This morning I went for a run and came back home after 2 mins because I forgot something... I forgot that I was fat and could only run for 2 mins.
942,Your mama so fat.. Her curve set everyone's grade to A+
943,I made a company that disguises land mines as prayer mats... Prophets are through the roof
944,"Damn girl, are you a 48-pack of frozen corn dogs? Because I thought it would last forever."
945,Warning: Dead baby joke What's the difference between a dead baby and a rock. You can't fuck a rock.
946,"Tea makes everything great,even meth. Cos without T,meth is just meh."
947,I can't believe I forgot to bring sunscreen to the beach.... ...boy was my face red.
948,He who smiles in a crisis has found someone to blame.
949,What did the lesbian vampire say to the other lesbian vampire? Same time next month?
950,Dallas Black people: please be Muslim please be Muslim please be Muslim Muslim people: please be black please be black please be black
951,My Wife is refusing to fry any food and is insisting on eating healthier. She is turning into a Kitchen Nazi. She keeps sticking everything in the oven.
952,2 words can open up many doors in your life. Push and Pull
953,Why are most Muslims broke all the time? They never understood the concept of piggy banks.
954,Why should we call Indians Native Americans? Most of those ones over in Asia have never even been to the States.
955,Knock knock..Who's there?..Interrupting coefficient of friction.. The interrupting coeff--- MU!
956,I just got back from r/Synesthesia It tasted great!
957,"Q: Why are elephants big, wrinkled, grey, and hairy? A: Because if they were small, smooth, white, and hairless, they'd be aspirin tablets!"
958,I accidentally left a butt plug up her ass for 2 weeks... No shit
959,"My ex broke up with me but left a bag of chips in my car. 3 weeks passed and I texted ""I still got your chips if you want them."""
960,"When googling Gary Oldman I highly suggest not forgetting the ""R"""
961,What do DNA and Diarrhea have in common? They both run in your jeans (genes)
962,"Well I was going to donate blood today until.... the lady got all personal and started asking, ""Who's blood is this?"" and ""How did you get it?"""
963,Colonel Mustard. In the kitchen. Eating soup. Calm down.
964,"[at funeral] ""it was so sudden"" really? ""yeah right in the middle of rap battle"" I thought you said he died of dysentery TERRY: That's right"
965,My wife's star sign was cancer and it's actually quite ironic how she died.. She was attacked by a crab.
966,I always eat at McDonald's when they do the Monopoly pieces. 1 in 4 wins obesity.
967,What did the pirates say who stole Kim Kardashians jewelry? We wanted her booty!
968,"I bet the guy who invented fake dog shit was upset the name ""shampoo"" was taken"
969,What do you call a lesbian dinosaur? (Slightly NSFW) A lick-a-lot-a-puss.
970,I think I'm gonna make a bracelet that supports getting rid of bracelets that support stuff.
971,[around campfire] ME: *grabs guitar* Hey kids how about a song? KIDS: Yeah! ME: ok *clears throat* LET THE BODIES HIT THE FLOOR LET THE BODI
972,"Luke, I am your father. Man you should see your face right now. It's all like waaaaaat no way."
973,"Money is the root of all evil, until the collection plate comes around"
974,how to get into shape: 1. punch a bear 2. run. this is your life now
975,"A little boy with diarrhea tells his mom he needs Viagra. The mom asks, ""Why on earth do you need that?"" The little boy replies, ""isn't that what you give dad when HIS shit won't get hard?!"""
976,What do you call someone who discriminates you for your oral hygiene? A dent*ist*.
977,Why do geologists perform so well during intercourse? They really know how to make bedrock.
978,Harry is a? Fucking WIZARD!
979,"On TV shows, answering machines are actually saying leave a message after the fuck."
980,What do James Cameron and M. Night Shamylan have in common? Icy dead people.
981,"""So, doctor, do I have cancer or not?"" ""Oh Jesus Christ, holy shit, tons of it,"" said the doctor to Martin Shkreli."
982,Billy Mays is in heaven now... Billy Mays is up in Heaven partying like it's $19.99.
983,"Late to Fight Club Was late to my Fight Club last night so I missed the intro rules. I love Fight Club, I'd highly recommend Fight Club."
984,It's green but when you press a button it turns red. A frog in a blender.
985,Whats the difference between Santa Clause and me ? Santa Only Cums Once A Year
986,"What do my wife and a chest freezer have in common? The exterior is hot, but its cold as ice inside."
987,Where did Napoleon keep his armies? In his sleevies.
988,I farted in a room full of hipsters.. then watched them fight over who heard it first.
989,I guess I prefer Subway because they make me feel like I'm making the healthy decision when I order a loaf of bread with 18 meatballs on it.
990,"i'm the girl your mom warned you about... long nails, big eyes, purple tongue, green skin. i'm reptar. i'm reptar from rugrats."
991,Where did Napoleon keep his armies? In his sleevies!
992,What did the mermaid do last Saturday night? She went out with the tide.
993,"Instead of sending friends Christmas cards, is it ok If I return the ones I got and just add the words ""Me too""?"
994,The phrase 'lazy asshole' is an oxymoron... Because an asshole gets shit done.
995,What do vegetables watch when they're horny? Corn
996,"I can't believe you ""accidentally"" let it slip into her butt! Dick move, asshole."
997,One of my favourite things is Pork Souvlaki on a Pita But it's hard to get the animal rights activists to stay still
998,New low: Looking in my purse and seeing my TV remote.
999,"If she's naming your wedding album on facebook ""wEdDiNg dAy!!!!!"" she's too young for you bro."