ID,Joke
520,What's the integral of 1/(cabin)? 1 natural log cabin. I'll show myself out.
521,What's the only thing an Irish person can hold on to? A grudge.
522,"A Midget Walked Past Me On The Sidewalk Today Wearing A Shirt That Said ""I Hate Black People"" ...I thought to myself ""Well damn- thats a little racist."
523,Nsfw Whats the difference between a Catholic priest and a zit? The zit waits untill you're 12 to come onto your face.
524,True: If you don't eat a whole basket of tortilla chips before your entree arrives in a Mexican restaurant it means you don't love your mom.
525,What do you get if you cross Bossy with a vampire?  Dracowla!
526,"A clown at the circus got tomato thrown at him from the audience, he turns and says HAY, THATS NOT FUNNY"
527,Doctors have confirmed that masturbation is life threatening Many men have died after having a stroke
528,"The Presidential Debate We don't know if Hillary is telling the truth, and we're hoping Trump isn't"
529,What does a sheep in denial say? Nahhhh
530,Q. How did the blonde die  ice-fishing? A. She was run over by the zambonis machine.
531,I really like those Black and White movies where no one speaks Inter racial porn.
532,hey girl are you my ceiling fan because i'm pretty hot but also too lazy to get up and turn you on
533,Alien 1: What are the Humans doing? Alien 2: Celebrating the existence of their mothers. Alien 1: I ate my mother. Alien 2: As did I.
534,"Remove all the poles if you don't want me stripping, Mr. Bus Driver."
535,What Did the Upvote whore say to the Redditor? I'll suck yo dick for a Upvote
536,Wiping your ass is a lot like a traffic light Red means stop.
537,I'm never more ruthless than when deciding who to wish a happy birthday to on Facebook and who to ignore.
538,"""I'll be a dentist. Then they'll love me."" ""We're terrified of dentists."" ""I'll kill a lion!"" ""It was a beloved lion with a name."" ""Dammit."""
539,Just because I'm Irish doesn't mean I am always drunk. It means I always want to be.
540,Just once I'd like to wake up as eager to start the day as my p*nis is.
541,My friend asked me... My friend asked me if there was a colored printer in the library I said wtf man it's 2016 you can use whatever printer you want
542,Subway's Jared got famous for fitting into smaller pants... ...now he is known for hoping to get into really small pants.
543,"Kissing a sleeping woman in an animated Disney movie, romantic.....but do it on a bus and the judge doesn't agree."
544,Why do melons always have big weddings? Because they can't elope.
545,What did Asian Jesus say before he was crucified? (OC) YORO (You only resurrect once)
546,What is the preferred coffee drink of people with alzheimer's? The Iforgotto
547,"You can consider yourself lucky in life, if the cognac you drink is older than the woman that you're sleeping with."
548,What's the difference between a dirty bus stop and a voluptuous lobster? One's a crusty bus station and the other's a busty crustacean. :D edit: funnier when said aloud
549,I just got a job helping a one arm typist do capital letters... Its shift work.
550,I decided today that I want to have kids I hope they taste good
551,What do you call a group of chickens dressed up like crows? A murder most fowl. (I'll see myself out...)
552,Which nut could pimp the Prince of Darkness? Mack-a-Dameon.
553,Italians and Spaniards are so used to Catholic child abuse... ... That they call the Pope daddy
554,If you find yourself in a hole. Stop digging.
555,Tom got a backache from working as a seer. He's got the hunch.
556,How many software engineers does it take to change a light bulb? None. It's a hardware problem.
557,I love how fresh & clean my bathroom smells after I've killed a spider with a full bottle of windex
558,Guest: Why did you offer me a piece of candy? Hotel Clerk: You said you wanted the best suite in the hotel.
559,"Daughter: Daddy, why do I have to go to bed so early? Me: Because we have had enough of you for today"
560,"Everyone in my class is arguing about science, And I'm just sitting here, maths debating."
561,"A policeman sees two boys, one with batteries, the other with fireworks He charges the first boy and lets the other off."
562,The best way of saving money is to forget who  you borrowed it from.
563,I like my chicken how I like my babies Deep fried and delicious
564,I bet a heroin addict could find a needle in a haystack.
565,what did cinderella do when she got to the ball? gag...
566,"I got in trouble for calling the rape hotline... Apparently it's only for ""victims""."
567,"My daughter asked me how much longer until she can be a grown up and I said, ""no."""
568,I saw a sausage fly by my window I must be going insane it was actually a bird. I think I've taken a Tern for the Wurst
569,"If Kevin Bacon never said ""want some bacon with your eggs"" to a lonely chick in a bar, life just doesn't make sense anymore."
570,"""Hey, wanna hangout?"" ""Later."" ""Now?"" ""No, later"" ""How about now?"" ""Jesus christ."" -if Adobe Updater was your friend"
571,"Follow your dreams. Unless you're a narcoleptic who wants to be a limo driver. That's dangerous, dude."
572,What was Hitler's last two words? Oy Vey!
573,Republicans help the poor during the holidays by sending 50 one buck at a time to panhandlers on the  street.
574,"I can't tell if Michael Cera is actually an actor, or just an awkward guy who keeps wandering onto film sets and does his best to fit in."
575,"I had a blind date once, her name was ..::..::.:::::...:::::"
576,How do you make Helen Keller cry? Turn the stool upside-down
577,Learning to love yourself is important. Just don't let your wife catch you doing it.
578,My life That's the joke.
579,"Sometimes the smartest thing you can do, is play stupid."
580,Me: My weight is up. I really hate winter. Him: Don't be discouraged. You'll bounce back in spring once you shave your legs.
581,"Me texting friend: Hey! What's up? Buddy: *sends picture of ceiling* Me: I am so glad I didn't ask ""how's it hanging"""
582,I cheated a guy in poker so he burnt down my house. I guess you could say it was a conflagration
583,"Two blonds are having a conversation. Two blonds are having a conversation when one says to the other ""I had sex with a brazilian last night"" The other blond replies ""WOW that's a lot of men"""
584,Did u hear about the leper poker game? everyone threw their hands in
585,"'I want to see other kids.' ~Me, parenting."
586,The nintendo 64 turned 18 last month Which means you can now legally blow the cartridges
587,They have arrived - Hia Dei Kum
588,Son: Are you eating pie for breakfast? Me (eating pie): No. Fruit casserole. Want some? Son: NO. I hate casserole. Me (whispers): I know...
589,"Before I lose my phone, end up naked, high, drunk and/or possibly arrested, I would like to wish you all a Happy Friday."
590,"My friend's a scientist and accidentally chilled his lab rat to absolute zero... At first the rat was just frozen, but he's 0K now."
591,What do you call a masturbating cow? Beef stroganoff.
592,"""Some say I have a drinking problem"" *pours glass of water on lap*"
593,"Fun typo: ""You ate the most important thing in my life."""
594,"A mushroom walks into a bar The bartender says: ""Get out of here! We don't serve your kind here."" The mushroom says: ""Why not man? I really am a FunGi."""
595,I voted for Jill Stein Finally I'm part of the 1%
596,Anyone got a 10 year old daughter I could introduce as mine? Stuck in an elaborate lie after putting my music on shuffle at a party.
597,What did the hamburger say when it pleaded 'not guilty'? I've been flamed!
598,Starbucks really isn't that expensive when compared to what Victoria's Secret charges per cup
599,What do you call little kids in Belgium? Brusselsprouts
600,They say love is worth more than money. But I'm pretty sure my landlord is gona want more than a hug.
601,I heard that Being the one to circumcise elephants doesn't pay too well But the tips are huge!!
602,Why does BuzzFeed skip every other number when counting? They literally can't even.
603,A Frenchman walks into a library and asks for a book on warfare. The librarian tells him he'll only lose it.
604,I held up a fist for a CW to bump and she kissed my ring. I am now drunk on power and no one is allowed to make eye contact.
605,"you knew the backstreet boys were actually friends because when the one boy asks if hes ""sexual"" the rest of the boys all agree that he is"
606,What's the difference between coriander and cumin? You can't coriander your pants.
607,"Sex makes your day, but anal makes you hole weak.."
608,"A sadist and a masochist meet The masochist starts pleading, ""Hit me! Please hit me!"" The sadist looks at him, smiles, and calmly replies, ""No."""
609,Got disoriented and walked into the wrong classroom. Didn't want to look stupid so I just went ahead and switched majors.
610,"Libertarian Presidential Candidate's new Campaign, inspired by Bernie Sanders. ""Feel the Johnson"""
611,"My wife urged me to be more experimental in the bedroom, but I guess she wasn't expecting I'd be dissecting so many white mice."
612,What did Spock find in the Enterprise Bathroom? The Captain's Log.
613,PSA: If you've got an Islamic dog... Muslim
614,How do you spot the blind man at the nudist beach? It's not hard
615,What did Jay say when Adnan opened the trunk? Hae girl Hae
616,ME: Is this Babies R Us CASHIER: Yes ME: No babies work here C: I know ME: It should be called Babies Were US C: ... ME: Get me your manager
617,"A girl grabbed my cock and said, ""Wow! Your dick wouldn't make a very good clock."" ""Why?"" I asked, intrigued. ""Because I'd struggle to get a second hand on it,"" she replied."
618,Broken pencils... ...are pointless.
619,"A man goes to the vet about his dog's fleas. The vet says: 'I'm sorry, I'll have to put this dog down.' The man is incredulous and asks why. The vet says: 'Because he's far too heavy.'"
620,"listen, officer - t h e o r e t i c a l l y - would I still get a carpool lane ticket if I have a body in the trunk"
621,An apple a day keeps my fruit-picking business trapped in bankruptcy.
622,What's a dinosaur's least favorite reindeer? Comet! =D
623,Why do seagulls live by the sea? If they lived by the bay they'd be bagels.
624,"When I lived on a houseboat I was seeing the girl next door, but eventually we drifted apart."
625,Donald Trump Does this count as putting the punchline in the title?
626,"My grandma got her bathroom redone with this sparkly gold-specked tile and she just called it her ""golden shower"" so goodnight."
627,What happens when frogs park illegally? They get toad.
628,"Shout out to my self-aware friends, you know who you are"
629,Why does it take pirates so long to learn the alphabet? Because they could spend years at C.
630,"There's a 100% chance the Republicans will discuss Starbucks cups in a debate tonight, so remember that when they ask how they lost in 2016."
631,"A man purchases a kitten, which he's having trouble house breaking. What does his friend say when he comes to visit? Your house is quite the cat-ass-trophy."
632,What do mutiny and an orgasm have in common? A sudden surge of seamen.
633,Why are normal human body temperatures around 98.7*F? Because we're all a little obtuse.
634,Communism jokes are not funny Unless everyone gets them
635,There are two types of people in life... Those who think there are two types of people in life and the rest.
636,"Dear Religion, Pics or it didn't happen. Love, Science"
637,My best friend and I were comparing our penises... for who has the biggest. It ended in a tie.
638,"If Trump wins, I'm leaving the country, if Clinton wins I'm leaving the country Not a political post, I just love to travel"
639,Why did the Storm Trooper decide to buy an Iphone? Because he couldn't find the Droid he was looking for.
640,What is the difference between a drug dealer and a hooker? A hooker can wash her crack and sell it again.
641,What's the hardest part about vaping? Telling your parents you're gay
642,"When I say I'm gonna take a nap, it means I'm gonna go on my computer for three hours."
643,Ropin' and Ranchin' by Larry Yett
644,My brother told me this today. Malayasia flight 404 not found.
645,I get turned on whenever I eat greek dips... ...I think I'm a hummusexual.
646,What is Moby Dicks dad's name? Poppa Boner
647,I love watching two girls meet each other. It's easily the most fake thing I have ever seen.
648,Pokemon Go has really improved my life... I used to always get in trouble for playing with my balls outside.
649,I showed up at Disney headquarters uninvited I said I was there for a Rogue One cameo That's how I learned the security guards have Tasers
650,I like my women like I like my coffee... [Fill in the blank]
651,Who does the Metric Cult worship? ...Demetre.
652,Why did the Canadian cross the road? Because that's the direction his car was sliding.
653,What do you do when you find Michael J. Fox in your hot tub? .....Add your laundry.
654,Describe yourself in one word Bad at describing myself with one word.
655,"Opinions are like Assholes... Everyone has one, and some just taste better than others."
656,"I don't always tell mom jokes But when i do, she laughs"
657,What do black men find most shocking about sex? Tazers
658,"Impotence: Nature's way of saying, ""No hard feelings"""
659,What do you call two gay Irishmen? Michael Fitzpatrick and Patrick Fitzmichael
660,Today I learned two things: 1. Build-A-Bear Workshop only lets you stuff fake animals 2. Mall security guards get to use real handcuffs
661,Why do elephants have 4 feet? Because in the animal kingdom 6 inches just wont do
662,"A blind guy walks into a bar... ...then a table, then a chair, then another chair..."
663,"I bought a muzzle for my pet duck. Nothing flashy, but it fits the bill."
664,There are plenty of fish in the sea. Sometimes you just need a really big fishing rod.
665,"Make sure you don't forget the 'R' when you're Googling, ""movies of Gary Oldman."""
666,"If I had a penny for every Donald Trump joke, I would have a small loan of one million dollars"
667,I like my steak like I like my women. White and domineering.
668,Retweet if you're naughty! Star if you love Jesus! Reply if you'd like to meet him!
669,Prostitutes hate trick-or-treaters.
670,"Woke up this morning with a pillow over my face, hearing someone muttering ""...it would be so easy..."""
671,"When are they going to drug test the audience of ""The Price Is Right.""? No one should be that happy."
672,The definition of spin
673,How to get a Jewish girl's number? Roll up her sleeve...
674,Why doesn't Hitler go ski? Cause he's blown his fucking head.
675,What's the best kind of grass? Emo grass; the grass that cuts itself.
676,Thought I could safely force a fart... But it backfired.
677,Why don't they have a WHITE history month?? Why don't they have NON-handicapped parking spaces? Why's there no cemetery for ALIVE people??
678,"The Lord said unto John, ""Come forth and be awarded eternal life"" John came fifth and was awarded a toaster"
679,Why does Anna's mom encourage her daughter to experiment with sexuality? Because she lives bicuriously through others .
680,Pretty busy at the gym this morning. I'm 6th in line for a selfie.
681,"*at a pizza buffet in the Midwest* Me: excuse me, can you please make a vegetarian pizza? Him: Sure! What kind of meat do you want on that?"
682,"Jokers of Reddit, any good blonde jokes or punch lines out there?"
683,How many portuguese people can fit on a scooter? A Brazilian
684,Now what's on the menu? Me-n-u
685,What is it called when you are on the edge of WiFi signal range? Router Limits!
686,What is Jeb Bush's campaign slogan? Third time's the charm
687,Year 2142: Meat eaters have died out. Vegans survive. 2143: Everyone is dead b/c the vegans couldn't tell anyone else that they were vegan.
688,My new years resolution is to have more sex! I Haven't told my cellmate yet though
689,Why do lawyer's suits never have pants pockets? Because their hands are always in someone else's!
690,Why does Helen Keller wear tight jeans? So people can read her lips.
691,"Go to racist joke, what's yours? Two unemployed Irishmen walk past a police notice board with ""two black men wanted for rape"" first one says ""fucking niggers get all the best jobs"""
692,"If you believe the home alarm commercials, the first thing burglars do when they break into your home is smash your family pictures."
693,What do you call a midget with no teeth A gum job.
694,It's just sad how often I see zookeepers breaking their own 'Dont Feed the Animals' rule.
695,You really have to question the judgment of people who have children on purpose.
696,What's green and smells like bacon? Kermit the frog's finger
697,"Why were there only 49 contestants in the National Ebonics Beauty Pageant? Nobody wanted to wear the sash that says ""Idaho""."
698,What do you call a bald porcupine? Pointless.
699,Scientists remain baffled as to why the people on the internet really like pictures of cats and cats doing things.
700,What do you do with old cannon balls ? Give them to elephants to use as marbles !
701,What did the two tampons have in common? They were both stuck up bitches
702,Why is Saturn like your balls?? Because it is in between jupeter an your anus.
703,"FREE $1,000,000,000 IDEA: a Tumblr-type platform for list-making called Schindlr"
704,My favorite kind of math is adding insult to injury.
705,I like Tuesday simply because it is literally the furthest from next Monday I can possibly be.
706,What's better than two roses on your piano? Tulips on your organ.
707,I tried googling Wiz Khalifa ... But all I found was MIa Khalifa peeing .
708,I am an expert at making balloon animals. May I interest you in a hyphen or a pickle?
709,What happened when the girl dressed as a spoon left the Halloween party ? No one moved. They couldn't stir without her.
710,What's the difference between wild Iranian Ossetra caviar and my penis? One is a delicacy (Deh-Lih-Cuh-See) and the other is a delicady (Deh-Lih-Cuh-Dee) Edit: The D
711,Who are the 3 most famous black women? 1. Oprah 2. Aunt Jamima 3. Motha Fucka
712,How do you disappoint a Redditor? [removed]
713,Why does Darkwing Duck wear a mask? You are a duck. No one could identify you without describing every other duck on earth.
714,"A bird pooped on my head today...Am I gonna die? I mean, I'm kinda worried about getting sick from it but mostly I hope this made someone's day."
715,"What do you call a man with no arms and no legs, lying in a ditch? Phil"
716,"Get a big metal box, label it ""TIME CAPSULE"" and take a big dump in it so people know what 2011 was like."
717,"I'm a terrible singer, I have two left throats"
718,How do you spot two bffs in prison They finish each other's sentences
719,TIL I'm genetically predisposed to love heroin It's in my blood
720,What do you call an iPhone 6S that ran out memory space. Successful
721,"Well, I had to break up with the baker i've been dating She was just too kneady"
722,You can't keep eating people's lunches from the break room & blaming the Taliban. A lot of what you've been stealing is pork for one thing.
723,"My wife says she's leaving me because of my obsession with karaoke. I said ""Fine, go on now go, walk out the door, just turn around now, because your not welcome anymore...."""
724,What do Shakespearian Buddhists eat for breakfast? Om and cheese Hamlets.
725,Q. What does a woman's asshole do when she is having an orgasm? A. He is usually home with the kids!
726,What does a slave driver do with his slaves when he's bored? He racism.
727,The Donner Party Diet Breakfast: Jacks Lunch: Franks Dinner: Patties
728,What did the farmer say when the police found the gate from the public footpath in his barn and accused him of stealing? That's not my stile.
729,Now marriage can be between any two people who are misguided enough to start a life together in New Jersey.
730,"A guy walks into a bar and says, ""I'm going to shoot whoever slept with my wife""! A man shouts from the back, ""You don't got enough bullets, bud""!"
731,Sometimes I'm depressed and then a girl stars one of my tweets and it's like YAAAAYYYY NEW GIRLFRIEND!!!!!
732,Maybe if Red Bull gave me buffalo wings i'd give a shit.
733,The road to recovery from my addiction to sexual innuendos has been a long and hard one. But the end is in sight... I can see it coming.
734,Why is my Tetris highscore like my wife? I beat both of them for fun.
735,"""Kids, grandma just had hip surgery so I need to warn you, she's not herself."" *grandma struts in wearing skinny jeans and smoking an E-cig*"
736,What do you call a motorcycle gang made up of ancient bisexual Norse monarchs? The bikings.
737,"They called their son Honest Abe, because he was honest. They called their daughter Bloody Mary..."
738,Has this one ever been used? Why didn't the chicken cross the road? Because he was chicken. Alright.
739,How do you double the price of a Fiat? Fill the tank
740,"Don't ask me for childcare advice unless you want nuggets of wisdom like ""always punch holes in the box so they can breathe."""
741,What do you call a bald porcupine? Pointless!
742,Why didn't the principal of the school for the blind allow his students to go duck-hunting? He knew that some of them wouldn't miss the blind ...
743,"new iPhone 7 son: Daddy, buy me the new iPhone 7 Dad: What is the magic word? son: Natasha Dad: who is Natasha son: your lover Dad: do you need also a case?"
744,What has 9 arms and sucks? Def Leppard!
745,Q: How many Honor Guards does it take to screw in a light bulb? A: 22 one to screw it in 21 to shoot the bulb.
746,"Cute girl: omg I love this bread [At the next table] Jesus: [loudly, holding up a slice of bread] so this is my body"
747,Did you hear about the Coldplay concert in China last weekend? It was all yellow.
748,What do you call a dumb elephant? Donald Trunk
749,What has 9 arms and sucks? Def Leppard.
750,Why don't prison inmates just use liquid soap?
751,A hawk snatched my gf's chihuahua today.. ..it got rid of that annoying bitch for me in one fowl swoop.
752,What do you call a witch who kills her mother and father? An orphan.
753,The people in this ad look 'indie' & remind me of myself. As a consumer this makes me feel good. Now I will purchase all their products
754,The first rule of procrastination club is: Google some weird shit then take a nap.
755,Don't touch my twat my itchy twitchy twat .... Miley Cyrus. Ba dum tish
756,"When a woman says ""WHAT did you just say?"" say something different."
757,"Sorry I pissed on the walls of your bathroom, but the flowery wall paper made me think I was outside.. Also you're out of Valium"
758,How do two lawyers greet each other? With a firm handshake.
759,What do you call bacteria that can swim fast? Micro Phelps.
760,me: can i have a coke waiter: is Pepsi ok? me: ya pepsi's fine pepsi: i have a boyfriend
761,My girlfriend used to kiss me on the lips but It's all over now.
762,What do you use to cut the ocean? A  seasaw
763,NEVER date someone that works for your cell phone provider. You're welcome.
764,What do you call a black man who dies of heat exhaustion and a white guy that dies of a brain aneurysm? Different Strokes
765,There is a new Barbie doll on the market - Funeral Home Barbie ...complete with hearse coffin and kicky little shroud
766,"Girlfriend: Did you fix the dishwasher? Me: Yup *girlfriend opens dishwasher revealing a monkey covered in bubbles, holding a scrub brush*"
767,Listen to your instincts. Your gut is always right. It may be a little bloated sometimes...but it's right.
768,I think r/jokes may be glitched Top of all time and new both show the same jokes
769,"In Florida, a couple has been accused of making meth in a public library. Isn't that crazy? Florida has a library. -Conan Monologue June 12, 2014"
770,I robbed a place with my boner and said it was a gun... I got a pretty STIFF punishment. I did HARD time. It was LONG sentence.
771,I repaired my drum set after my son broke it... ... ... Now he has to deal with the repercussions.
772,"Pork is awesome, but it's best when used as a verb."
773,[Spelling Bee] -Your word is phlegm -Can you use it in a sentence? *loudly clears throat for 5 minutes*
774,"COP: PUT YOUR HANDS UP OCTOPUS: They're tentacles COP: OK PUT ALL 8 TENTACLES UP OCTOPUS: Two are my legs, dude COP: Just go. I give up."
775,"If you're reading this you're probably addicted to the internet. And by internet, I mean Facebook."
776,Hotel California is basically a negative Yelp review with a two minute guitar solo.
777,Did you hear about the Pirate suffering from scurvy? His attempts to cure it were *fruitless*.
778,What do you call an african american in a 3 piece suit? The defendant.
779,What do you call a German with a bad attitude? A sour Kraut.
780,"Apparently when your boss asks if you're on drugs ""which drugs?"" isn't the appropriate response. I know this now."
781,"I think it is wrong that the Bali 9 get a one minute silence I mean, they already got a 21 gun salute."
782,"When I die, I want a disease named after me, with symptoms that include ""being fucking awesome at everything."""
783,''I want to ruin some songs today.'' -The producers of Glee every morning.
784,How do you know you sister is on her period? Dad's cock tastes like blood.
785,"McDonald's french fries are not real food. Just found one under my car seat from two months ago and it looked perfect. Tasted fine, too."
786,The only thing better than sarcasm... is irony.
787,"Ay' girl,is your dad a terrorist Cause you re da bomb"
