ID,Joke
265,I left Stephen Hawking like 8 voice mail messages before I realised he'd picked up every time.
266,My terrible Joke but I never forget it. A dyslexic man walked into a bra....
267,What type of school did Sherlock Holmes go to? Elementary :)
268,"Believe it or not, my wife and I were actually matched on Tinder. We'd been married for 12 years."
269,"I scream, you scream, we all scream for ice cream. This kid working at Baskin Robbins is pretty scared. Now he's crying in the corner."
270,"So a Trabi owner pulls up to a gas station... ...and says to the attendant: ""Two windscreen wipers for my Trabi please."" The attendant replies: ""That sounds like a good deal!"""
271,"How many police officers does it take to change a light bulb? None, because they'll just beat the room for being black!"
272,Coffee so good it helps a little old lady cross the street.
273,Why did the semen cross the road? Because I put on the wrong pair of socks this morning.
274,What did nazi pilots eat for breakfast? Luftwaffles
275,So a blind man walks into a bar He hurts himself pretty badly.
276,"If you're not one of the first five boys in the yard, you almost never get a milkshake."
277,sometimes i visit websites that have videos of people making love
278,Why aren't Tyler Perry movies for the light-hearted? They're dark comedies.
279,Every woman I've ever been with only saw me the way they wanted to see me... ...in their rearview mirror.
280,How do you tell the circumference of a pecan Pecan pi
281,"How do you figure out which contestant in a Ms. America pageant is a prostitute? Look for the one with the sash that says ""I da ho""."
282,Ethiopian Cuisine... is a bit bland. It tastes like nothing.
283,I love raccoons. Part cat. Part dog. Part rodent. Part bear. Little people hands. What's not to like?
284,[Google search history] Moles How to kill moles How to make homemade bombs Rescue moles from cave-in Dealing with regret Mole stew
285,A guy walks into a bar... Ouch.
286,"Standing in the park, I was wondering why a Frisbee gets larger the closer it gets. And then it hit me."
287,"When in doubt, just do the opposite of whatever the person wearing pajamas in public is doing."
288,[Ouija board] Spirits are you there? U R C U T E D O Y O U H A V E K I K *flips board*
289,Not being able to read because your book ran out of batteries is a pretty hilarious first-world problem.
290,My internet connection on my farm was be terrible until I moved the router in the horse barn. Now I have stable WiFi.
291,Putting captions in the wrong place You know what I hate the most...?
292,What does a sheep call a film it doesn't like? a baaahhhd movie. (   )
293,An irishman walks out of a bar...
294,Brexit There is a new slimming product in town. It is called Brexit. It'll help you lose a lot of pounds.
295,"Orange Julius is the third best thing to happen to oranges behind mimosas and the ""orange you glad I didn't say banana"" knock knock joke"
296,What is a bear's favourite drink ?  Koka-Koala !
297,Why do golfers wear 2 pairs of pants? Incase he gets a hole in one
298,How do you stop a baby from crawling in circles? Nail its other hand to the floor.
299,What is the favorite food joint of dubstep makers? Sub-WUB-WUB-WUB-way
300,"Two fish are in a tank... One is driving, and the other is manning the guns."
301,Steve wrote home. 'I'm glad you named me  Steve' he said in the letter. 'Why?' asked his mother in her reply. 'Because that's what all the kids at camp call me' he wrote  back.
302,Do hamburgers make good vampires? No because they always find themselves in ghoulash situations!
303,"Whilst at college I did experiment with marijuana. I did it in snow, I did it in sleet, but I did not in hail. ^-- ^Ed ^Byrne"
304,I paid 10.50 for a movie ticket to watch Tom Cruise die continuously for 2 hours. I would have paid a hundred dollars to watch that.
305,"A Spanish magician announced that for his final trick, he would vanish into thin air. He counted down: uno, dos, then POOF! He was gone, without a tres."
306,Is that mine? I was walking down the street when I saw black guy with a laptop. Is that mine? I thought. It looks exactly like mine... but that can't be... Mine should be at home cleaning my shoes.
307,A Bug's Mind What's the last thing that goes through a bug's mind when he crashes into a windshield? His asshole.
308,"My mom recently bought a Jesus shaped flashlight When I asked her why she said: So whenever someone says ""I can't see"" I can be like ""here, let Jesus light the path"""
309,"Why is my Chinese girlfriend so bitchy? Well it's true, you are what you eat."
310,They just found a Black guy hanging from a tree with 79 stab wounds in Alabama.... The police say it's the worst case of suicide they've ever seen
311,Q: How many Kings of Spain does it take to screw in a light bulb? A: Juan
312,Don't you just hate it when people answer their own questions? I do.
313,The hotel we stayed in for our holiday offered bed and board but it was impossible to say which was the bed and which was the board.
314,"My new cooking show, ""Will Sasso Cooks With His Exposed Dick Really Close to the Food"" premieres tonight (8/7 Central) in my mind. Be there!"
315,*nose hairs growing out of control *buys tiny scissors *jam them in the eyes of whoever I catch staring at my nose hairs
316,"I'm trying to write a poem for my girlfriend, does anyone know what rhymes with threesome?"
317,"Pro tip: If a woman asks you how she looks, the correct answer is not ""like Dan Aykroyd."""
318,"I complained to my wife that I was short staffed at work She responded ""yeah, and you have the same problem at home"""
319,I overheard two female coworkers say there was a creepy dude listening to their conversation.
320,What do you call kangarooo jump and play hocky? the fam copter
321,What is the internal temperature of a tauntaun? Luke warm
322,What's black and white and red all over and can't get through a revolving door? A nun with a spear through her head.
323,What idiot called her a Hot Indian Girl and not a Bomb Bae
324,Ignorance is not bliss. It's just a fancy word for stupid.
325,"What did the Marine Biologist say when he saw two eels making love? ""It's a Moray."""
326,"I submitted 10 of my best puns to a Joke competition expecting at least 1 to win, but... No pun in ten did.."
327,Shoutout to people who don't know what the opposite of in is. I'll give you some time for this one.
328,Did you guys know that water can talk? Water you talking about?
329,ME: all the King's horses and men couldn't put u back together HUMPTY DUMPTY: what now M: [opening package of bacon] I'll think of something
330,How many Alzheimer's patients does it take to screw on a light bulb? TO GET TO THE OTHER SIDE!
331,If chopsticks were really better than a fork... ...wouldn't we be digging ditches with pool cues?
332,"First woman on the moon W: Houston, we have a problem H: What is it? W: Nevermind its nothing H: What is the problem? W: Nothing... H: Tell us what the problem is! W: NO!"
333,"Thank god I have the newest, fastest iPhone so I can mindlessly check the same three apps 500 times a day."
334,Jared Fogle was guilty and got 16 years He was just grateful for anything under 18. Credit to SNL that joke might have converted me to watch.
335,What's an STD's favorite kind of pizza? Heperoni
336,This hating of people who breast feed in public places has to stop! I'll raise my dog however I like.
337,A woman's JJ sized breasts saved her life in a car accident. Those same breasts were the cause of her husbands death in a motorboating accident.
338,Recent studies show that 1 out of 3 Americans weigh as much as the other 2 put together.
339,"[date gets back from the bathroom] those batman toys in the tub are so cute! How old are your kids? ""kids?"""
340,"I just Googled 'Nicolas Cage jokes' and it showed me a list of every film he's been in. Well played, Google."
341,"I've been listening to the official workout station on Pandora for 3 months and I'm still fat, I'm calling bullshit."
342,I was going to break up a fight between two Rabbis... But they were just arguing semitics.
343,"Pavlov's doorbell One tuesday afternoon Ivan Pavlov is reading the paper, when his neighbour rings the doorbell. Ivan jumps up out of his chair, suddenly remembering: ""Shit, I need to feed the dogs!"""
344,What did one tampon say to the other tampon? Nothing they were both stuck up cunts.
345,HER: You look so nervous. ME: *nervously* HA. I'm never nervous. HER: You're sweating. ME: *just freaking out* That's bravery moisture.
346,"When I was 8 years old, my dad got me with the worst dad joke ever. He said he was going to the store and would be back soon..."
347,Do you hate yourself? Do you wish someone would trip you down stairs? Do you enjoy lacerations & and surprise vomit piles? *hands you a cat*
348,"I found where my mom hid the scissors, so everyone in my house woke up with a new haircut this morning."
349,What do you call the retarded guy that follows the band around? The Drummer
350,What is the best thing about twenty six year olds? There are twenty of them
351,"Why was there semen on the clean laundry? When Greg woke up, his mom had left a note reading, ""Please put a load in the washer"""
352,What did the Mexican say when I pushed him on the lawn? Grassy Ass!
353,I once was bored so I decided to eat a clock to *pass the time*. It was very *time consuming*. Yuk yuk yuk yuk yuk
354,What do you call a grammatically incorrect horse? An horse.
355,"Have you ever seen those ""Give a penny, take a penny"" things at convenience stores??? that makes no cents"
356,Me: .... Dog: ... Me: .... Dog: ... Me: ... Dog: ... Me: .... Dog: ... Me: ... Dog: ... Me: ... Dog: have the shrooms kicked-in yet? Me: ..
357,I bet if I were a MAN Apple wouldn't tell me my password ideas are weak.
358,"if people really didn't want to hear smartass responses they wouldn't keep asking questions like ""do you know why i pulled you over?"""
359,I have this fun drinking game where you take a drink every time you'd like one because you're an adult and you can make decisions yourself.
360,"I'm sorry, Black Lives Matter is actually a peaceful and forward thinking movement that our society needs... Now if you could all stop sending me death threats on twitter that would be great."
361,"My girlfriend left me after I broke her wheelchair..... Oh,, I think she'll come crawling back soon.."
362,"Someone should invent a version of Twitter for people who spell things like rappers. They could call it ""twita"". Dat would b nize"
363,"NSFW Men are like a deck of cards... You need a heart to love him, a diamond to marry him, a club to smash his fucking face in and a spade to bury the bastard!"
364,The Grapes of Wrath 2: The Raisins of Revenge
365,"Yes, life is meaningless, but some of the food is decent."
366,"""You know what."" -- They."
367,I don't like drive-thru's I think it's money out the window.
368,What do you call a Chinese conga line? A Chu Chu train
369,Why was pregnant Cinderella late to the ball? Miscarriage
370,THE HORROR! *splat THE TRAGEDY! *splat IT'S AWFUL! *splat SO MUCH BLOOD! *splat WHY IS THIS HAPPENING?! *splat -It's raining men.
371,What the quickest way to a mans heart? Though his chest with a knife
372,*watching Dateline* wow this is the worst dating show ever
373,Where do you find an enlightened mosquito? In Bhuddapest
374,"Guy comes home with a flower bouquet... ""Guess I'll have to spread my legs now"", says the wife. ""Why? Don't you have a vase?"" the husband replies."
375,"Two rabbits were being chased by a pack of wild dogs... One says to the other ""should we stop and outnumber them?"" ... &amp;nbsp; ""keep running you fool we're brothers!!"""
376,I just got a new job at a gay magazine. I'm a poofreader.
377,No one is more unnecessarily confident than a white person that just ordered Mexican food in a Spanish accent.
378,If these walls could talk I'd fuckin' move out immediately.
379,What do you call it when two designers argue about what file type to export a graphic to? Getting into a bit of a .tiff!
380,"A doctor reaches into his pocket and finds his rectal thermometer He says ""Shit, some asshole took my pen!"""
381,how many people does it take to save the world? zero (compliments to my SO who thinks she made this up)
382,How do skeletons reproduce? They bone.
383,Finally got around to shaving my crotch after a few years. Its nice to see my knees again.
384,I'm ready for the cop-buddy film where they actually get along in the beginning but hate each other by the end.
385,How many people does it take to change a light bulb in Brazil? A Brazillion!!! http://imgur.com/c4CJjUd
386,How do you make an Amish woman happy? Three Men-A-Night
387,Letsh Have Shex! -Horny Sean Connery
388,"If two people had a race and one had sand in his shoe but the other did not, who would win? The one with sand in his shoe -- if it was quicksand."
389,I know dream catchers don't work because I've never seen one in a car worth more than two thousand dollars.
390,Thankful that Five-Fingered Shoes company doesn't make pants.
391,When is a pedofiles favorite part of a hockey game? Before first period
392,What do you call a vegetable who has escaped prison? An escapea
393,"At my last checkup the doctor said he needed a urine sample, a semen sample and a stool sample ... ... I said "" Doc, I can speed this along - I'll just leave you my underwear !"""
394,[pulls out acoustic guitar at a funeral] alright everyone stop being all [finger quotes] sad this next 1 is dedicated to a very sexy widow.
395,"If you do not say it, they can't repeat it."
396,"Life is like art done in chalk, beautiful but temporary, enjoy it while possible."
397,"If there are three gay guys in a bath and a lump of cum floats to the surface, what do they say? Who farted?"
398,Why the gills in the sea don't drink tea even though there is plenty of water That will make them all guill tea!
399,Taking calculus has made me want to become Prime Minister of a European country Then I can just throw money at problems instead of trying to integrate them.
400,My friend used my todo list to roll a blunt He's high on my list of priorities
401,"From now on when skinny girls say they're fat I'm just gonna be like, ""Yup"" & walk away."
402,What did the homeless person say to the gay job interviewer when asked for his address? No home-o.
403,How many people with dementia does it take to change a lightbulb? To get to the other side.
404,What type of fruit is not allowed to get married? Cantaloupe...
405,I like my women like I like my coffee... I don't fucking like coffee.
406,butts are truly the final frontier. to think we know more about SPACE than we do about the human butt. two fleshy mounds of mystery & wonder
407,I find like geologers make really good friends... ...they are very down to Earth.
408,"I keep getting the urge to purchase a big white bear from the artic... ...Doc says I might have ""Buy Polar"" disorder! EDIT: arctic*"
409,Heading to Chinatown after work... I heard it's Erection Day.
410,How do you get a gay man to fuck a woman? Shit in her cunt.
411,I want to start a coffee shop that only plays ambient/electronic music... and call it Brian Beano.
412,I like my girlfriend's new glow-in-the-dark braces... ...her smile really lights up the room now.
413,This bank pen tastes like it's been in a lot of other people's mouths
414,Redditors don't like this [Deleted]
415,"Mom writes to her son in Poland's army: ""Dear Son, I am writing this letter ever so slowly..... ....because I know you cannot read fast"""
416,Did you hear about the calendar thief? He got 12 months; they say his days are numbered!
417,The best thing about adolescent humor... is that it never gets old!
418,I hate how the losers of every election maintain such a high view of themselves... They're conceded
419,"I didn't see mommy kiss Santa, but my sister saw her kiss the mailman, which explains why I'm the only one with brown eyes in the family"
420,Why did the vampire attack the clown? He wanted the circus to be in his blood.
421,"""It's 5 o'clock somewhere."" - a shitty watch."
422,How do I know when your sister's on her period..... Your dad's dick taste like blood
423,What do you call going Doctor to Doctor... What do you call going Doctor to Doctor to figure out what your inflammatory bowel disease is called? A Game of Crohn's.
424,What's the difference between a pizza and a black man? The pizza can feed a family of 4.
425,"Knock knock. Who's there? Benjamin. Benjamin Who? Yes, Benjamin Netanya Who."
426,"If you hear the words ""oh yeah, suck it"" coming from my bedroom, it's probably just me vacuuming."
427,"A photon walks into a hotel The bell boy walks up and asks, ""Do you have any luggage?"". ""No,"" says the photon, ""I'm traveling light."""
428,If your'e anxious and you know it..... ...clasp your hands.
429,its macaroni and cheese not macaroni and steve
430,"People always complain that I'm ""out there."" [On the phone. To the cops. While I'm sitting in their birdbath.]"
431,*job interview* Why do you want to be a psychiatrist? *pictures clients acting like chickens after I click my fingers* I want to help people
432,Here's two short jokes and a long joke: joke. joke. joooooooke.
433,"""911, what's your emergency?"" Me: A cute guy at the laundromat walked past me while I was folding my period underwear."
434,What do you call a relaxed redneck? A chillbilly.
435,Dog's Facebook status: Tried to save the master from the vacuum cleaner today... He just yelled at me.
436,Ever since the news came out about Samsung.... Their phones have been blowing up.
437,Osama Bn Laden Jokes in the title.
438,"What is the term for a group of Canadians? Is it ""an apology""? ""Oh look, there goes an apology of Canadians"""
439,"Trump wants to appoint Ben Carson to the Department of Education, but I think he would do better in the FDA He can feed everyone with all of the grain in those pyramids."
440,"Putting a woman on a $10 makes sense . . . . . . no one really wants a 1 or a 5. (As heard on Wait, Wait, Don't Tell Me)"
441,"I always check my smoke alarms to make sure they're working. I call it ""cooking"""
442,"[wife looking at pictures of my dead body with police] ""why isn't he wearing a shirt"" we believe he removed it when he challenged the coyote"
443,Put the punchline in the title. How do you piss off a redditor?
444,I just found out I am a hipster Because I started using #NotMyPresident 8 years ago.
445,What's the difference between a computer and a woman? A computer only has to have information punched into it once.
446,I just released my mixtape in Tianjin. It was da bomb. Too soon?
447,"How to meet a girl: 1) Walk into a bar. 2) Shout ""Heroes in a half shell."" 3) When a girl yells back ""Turtle Power,"" marry her."
448,What's the sharpest thing in the word? A fart. It goes right through your pants and doesn't leave a hole.
449,"*calls into work* ""yo boss i'm real sick"" ""you don't sound sick..."" ""ya, just got a new tribal tat & heelys"" ""wow u do sound hella sick"""
450,I'm not saying that girl's a slut... But she has touched more wieners than Heinz ketchup.
451,A Kiss can make my whole day... But anal could make my hole weak
452,The best joke you'll never hear
453,how are a silver medalist and a priest alike They both came in a little behind
454,I wonder if a ghost has ever watched me masturbate.
455,S is my favorite letter because it changes biscuit to biscuits.
456,Saw a homeless guy babbling about conspiracy theories that doesn't really make sense... You could say it was a vague rant.
457,"Blessed are those who are cracked, for they are the ones who let in the light!"
458,Remember before Amazon reviews when you could just buy a toothbrush without 6 hours of research?
459,Don't judge me because I like 80's music. Judge me because I had a late term abortion because a baby would ruin my holiday plans.
460,When someone uses the bathroom and asks about the wine cork floating in the toilet is why I don't invite people to my house.
461,What's a con-artists favorite holiday? Scamentine's Day.
462,"An infectious disease enters a bar... the bartender says,""we dont serve your kind here"". The disease replies, ""well you're not a very good host!"""
463,If four out of five people suffer from radiation poisoning... Does that mean the fifth one enjoys it?
464,Having the option to erase and re-record after having to leave a voicemail is one of my favorite things about life.
465,My neighbours are loud and obnoxious. Now I know how Canada feels.
466,Stealing mosquito repellent... Jacking Off!
467,"What do you call a small, noisy dog? A subwoofer."
468,September is Alzheimer's Awareness month... remind me tomorrow.
469,"Well it's like my dad always told me ""When life gives ya lemons"" Chances are you're in the fruit aisle."
470,What English King invented the fireplace ? Alfred the grate !
471,I just saw the Assassins Creed Movie Trailer... I did not expect The Spanish Inquisition.
472,Why do Canadians do it doggy style? So they can both watch the hockey game.
473,"Dad and son A son asks his father ""Why does my bum hurt"" while the father replies ""Because I love you son"""
474,Why does little sally have a limp? SHE WENT TO JARED!
475,A programmer began to cuss Because getting to sleep was a fuss. When laying in her bed Looping round in her head Was: while (!asleep()): sheep++;
476,"""Oh you just put lotion on? You're not going anywhere."" - Doorknob"
477,I see you've got your bill for using the Internet Yes and my dad's really going to get the hump!
478,When do you kick a midget in the balls? When he's standing next to your girlfriend saying her hair smells nice
479,Islam is a race. Because it's inbreeds fucking each other.
480,Why don't you want your nose to be 12 inches long? because then it would be a foot!
481,Political Joke The Economy
482,"Keep in mind that ""The Cat in the Hat"" is a lesson to your kids on how to throw a house party when you're gone..."
483,What's a lumberjack's favorite director? TimBuuurrrrrrrton
484,Why do midgets laugh when they run? Because the grass tickles their balls
485,"When someone tells you to ""get a Life,"" just take theirs. They'll be happy you took their advice, and you'll be happy they're dead."
486,"Day One, living in one of those tiny houses: ""Well, isn't this quaint?"" Day Two: Murder"
487,"How to get a job... Interviewer: ""What's your biggest weakness?"" Interviewee: ""I never learn from my mistakes"" Interviewer: ""Oh, why's that?"" Interviewee: ""I never make any"""
488,"I showed my son a floppy disk today... ...he said: 'oh cool, you 3D-printed a save icon'"
489,What do golfers do on nights out? **par**ty.
490,"How does an Australian clean is bum? Bidet, mate."
491,I feel quite light today. Pounds aren't what they used to be.
492,"""Beat up anybody you see drinking 7UP"" -first rule of Sprite Club"
493,Never attribute to malice what can be adequately explained by stupidity.
494,"Yo mama... Yo mama is so poor, she can't even pay attention"
495,Difference between priest and acne? What is the difference between a Catholic priest and acne? Acne waits until puberty to come on a kid's face.
496,"Them: If you were stranded on a desert island with any two people, living or dead, who would they be? Me: Can they both be dead?"
497,T Rex isnt so scary if you imagine a bunch of baby T Rexes watching Barney just giggling and rolling around on the ground playing with keys.
498,Since Michael Jackson's death hundreds of children have gathered at the gates of Neverland. Police have said that they will let them out once they find a locksmith. - http://ww.key-n-lock.com
499,Did you hear about the constipated dyslexic? He had trouble moving his elbows.
500,Why are mountains so funny? Because they are hill-areas
501,Why do gay men always have candles near their asses? So the gerbils can find their way out.
502,"[At the coroners' to identify a body] Me: ""Yep. That's a body all right."""
503,What do Jesus and your mom have in common? They both got nailed all night.
504,"How does J.G. Wentworth tell you that he's hungry? ""It's my tummy, and I feed it NOW!"""
505,I can see you're upset. Maybe you should post more about it on Facebook. That should eliminate any more drama.
506,"Dear lord, I thank you for these noodles I am about to eat. Ramen."
507,I have a pen..... I have a apple :D
508,"I want a girlfriend with OCD, that way whenever I want to go home I can just say ""Are you sure you checked the stove before we left?"""
509,Nothing good has ever gone into a microwave at 3:00am.
510,woke up just in time to push my cat off the bed before he threw up. today is going to be magical.
511,Just stirred my coffee with a fork if any of you guys are looking for a new bad boy to join your crew.
512,I was licking this girl all over her face right up until she explained to me what doggy style was.
513,What's the name of the best brewer in the world? Bock Goodale
514,If your tweet gets stolen and posted on Facebook... It's your own fault for not making it offensive enough!
515,To all the girls that say Gentlemen don't exist anymore: They do exist but Gentlemen are attracted to Ladies. Not s?uts.  Sorry.
516,Did you hear about the idiot who invented the one-piece jigsaw puzzle?
517,"""Sugar"" is the only word in the English language where ""su-"" makes a ""sh"" sound. At least, I'm pretty sure..."
518,A horse walks into the bar Several people left because they realised the possible dangers of that situation.
519,I've decided to make an all-natural shampoo made from roots found in Africa. I'll call it Ethnic Cleansing.
